{
  "version": 1,
  "source_run_id": "run-qa-fixture",
  "answer_digest": "bbbbbbbbbbbbbbbbbbbbbbbbbbbbbbbbbbbbbbbbbbbbbbbbbbbbbbbbbbbbbbbb",
  "proposal_title": "Clarify payment ownership",
  "question": "Who owns payments?",
  "answer_generated_at": "2026-07-26T10:00:00Z",
  "citations": [
    {
      "path": "reports/as-is/overview.md",
      "reason": "Architecture Home evidence."
    }
  ],
  "unresolved": [],
  "created_at": "2026-07-26T10:05:00Z"
}
